,title,brand,description,details,long description,availability,ships from,sold by,price,product url
0,Kuchenprofi 18/10 Stainless Steel Funnel with Filter,Küchenprofi,"'Wide-mouth design ensures smooth, splash-less operation.', 'Fine mesh filter Included; traps herbs, burned bits and other unwanted particles', 'Easy to strain big batches of stock or sauce, or filter oil', '18/10 stainless steel; measures 5 inch diameter by 3-1/2 inches high', 'Dishwasher safe'","'Brand Küchenprofi', 'Model Number 121038', 'Color Silver', 'Product Dimensions 13.97 x 10.16 x 13.34 cm; 226.8 Grams', 'Material Stainless-Steel', 'Item Weight 227 g'","'Style Name:Filter', ""Founded in Solingen Germany by Artur Schmitz in 1923, the story of Kuchenprofi is one of dilligence, innovation and refinement. Early on, Kuchenprofi realized the need for affordable functional tools that make the kitchen more efficient and more enjoyable. The name of Kuchenprofi reflects strength, quality and functionality demanded by chefs around the world. Kuchenprofi made for professionals, now available to anyone passionate about cooking. Kuchenprofi's Funnel & Filter makes it easy to strain big batches of stock or sauce, filter oil from deep fryers – even rinse delicate berries. Wide-mouth design and stable base ensure smooth, splash-less operation. Lift-out fine mesh filter traps herbs, burned bits and other unwanted particles. Crafted of 18/10 stainless steel. Dishwasher safe. 3-1/2-inch high, 5-inch diameter.""",['Only 4 left in stock.'],Amazon AU,Amazon AU,$44.15,https://www.amazon.com.au/Kuchenprofi-Stainless-Steel-Funnel-Filter/dp/B00008WV52/ref=sr_1_128?dchild=1&m=ANEGB3WVEVKZB&qid=1601494762&refinements=p_36%3A3900-5000%2Cp_n_free_shipping_eligible%3A5363790051%2Cp_72%3A2547912051%2Cp_6%3AANEGB3WVEVKZB&rnid=5355409051&s=kitchen&sr=1-128
0,"Dr. Oetker loaf tin 25 cm Back-Liebe EMAILLE, Robust Bread tin with Cut- & Scratch-Proof Enamel Seal, Cake tin for Juicy Cakes and Hearty breads (Colour: Blue)",Dr. Oetker,"'For gourmets and passionate bakers – for aromatic pound cakes and juicy, fluffy breads that impress with great taste', 'Results: Excellent baking results with outstanding heat transfer for even browning', 'Delivery includes: 1 x bread tin (approx. 25 x 7,5 x 11 cm) – best quality from Dr. Oetker', 'Material: Steel sheet with enamel seal – heat-resistant to 400°C & dishwasher-safe', 'Quality guarantee: 10-year Dr. Oetker guarantee – Made in Germany'","'Brand Dr. Oetker', 'Model Number 2367', 'Color Blue', 'Product Dimensions 25 x 11.5 x 7 cm; 500 Grams', 'Material Enamel', 'Item Weight 500 g'","'Size:25 cm', 'Dr. Oetker bread tin 25 cm BACK-LIEBE EMAILLE', 'Make every cake a success with this bread tin from the Dr. Oetker “Back-Liebe Emaille” premium assortment with cut- and scratch-proof enamel seal. The durable mould impresses with excellent heat transfer, ensuring even baking results. The mould is also fruit acid and heat-resistant to +400°C. It can simply be cleaned in the dishwasher after use. Dr. Oetker provides a 10-year quality guarantee for the ""Made in Germany"" premium baking sheet.', 'Quality is the best recipe!', '» Dimensions: approx. 25 x 7,5 x 11 cm', '» Material: Steel sheet with enamel seal', '» Cleaning: Dishwasher-safe', ""With Dr. Oetker, you are placing your trust in a family-run company which has had a special relationship with its customers for more than 125 years. All Dr. Oetker baking tins and kitchen aids are tested and certified in Dr. Oetker's own test kitchen. Thanks to many years of experience, you can always rely on the quality of Dr. Oetker kitchen aids and their ability to deliver successful results every time.""",['In stock.'],Amazon AU,Amazon AU,$39.67,https://www.amazon.com.au/Dr-Oetker-2367-Quality-Bakeware/dp/B000UVHY76/ref=sr_1_129?dchild=1&m=ANEGB3WVEVKZB&qid=1601494762&refinements=p_36%3A3900-5000%2Cp_n_free_shipping_eligible%3A5363790051%2Cp_72%3A2547912051%2Cp_6%3AANEGB3WVEVKZB&rnid=5355409051&s=kitchen&sr=1-129
0,"AdHoc AH1140 Chilli Mill, 22cm, Silver, AH1140",AdHoc,"'All of AdHoc products are crafted with the highest quality materials and seamless German design, optimised to deliver flawless functionality and eye-catching aesthetics', 'Specialising in grinders and graters, AdHoc also deliver a range of utensils, designed to enhance your cooking experience, as well as tea and wine accessories', 'The interaction of function and form is a source of pleasure for our customers, and should improve kitchen and tabletop culture, which is reflected in each product', 'Modern aesthetics and easy handling', 'Material: Stainless Steel/Acrylic'","'Brand AdHoc', 'Model Number MP203', 'Color Silver', 'Product Dimensions 4.57 x 4.57 x 21.34 cm; 182 Grams', 'Material Stainless Steel', 'Auto Shutoff No', 'Item Weight 182 g'","'AdHoc Pepe Chilli Mill 22cm. All of AdHoc products are crafted with the highest quality materials and seamless German design, optimised to deliver flawless functionality and eye-catching aesthetics. Material: Stainless Steel/Acrylic.'",['Only 2 left in stock (more on the way).'],Amazon AU,Amazon AU,$39.95,https://www.amazon.com.au/Adhoc-Stainless-Acrylic-Cutter-8-Inch/dp/B003EGCTGU/ref=sr_1_195?dchild=1&m=ANEGB3WVEVKZB&qid=1601494762&refinements=p_36%3A3900-5000%2Cp_n_free_shipping_eligible%3A5363790051%2Cp_72%3A2547912051%2Cp_6%3AANEGB3WVEVKZB&rnid=5355409051&s=kitchen&sr=1-195
0,"LA Linen Burlap Potato Sacks 23x40, Pack 4",LA Linen,"'Size is approximately and may vary from 23x 40. Sacks have a distinct scent and would dissipate over time when the sacks are aired Out', 'The scent is from the Natural fibers, an air Purifier and germ killer. A reason this sack is used in storage of food and produce', 'We recommend rolling your Potato sacks to prevent creases and storing them in a dry cool place', 'Order includes 4 burlap sack'","'Fabric Type 100% premium natural jute burlap', 'Is Assembly Required? No', 'Batteries Required No', 'Import Designation Made in the USA and Imported'","'Colour:Natural  |  Size:4-Pack', 'The sack race or gunny sack race is a competitive game in which participants place both of their legs inside a sack or pillow case that reaches their waist or neck and jump forward from a starting point toward a finish line. The first person to cross the finish line is the winner of the race. In some cases the winner of these races are rewarded with a prize of some sort. These sacks are made with natural jute burlap also known as hessian cloth.'",['Only 1 left in stock.'],Amazon AU,Amazon AU,$41.05,https://www.amazon.com.au/Linen-Burlap-Potato-Sacks-23x40/dp/B01H73PBYW/ref=sr_1_196?dchild=1&m=ANEGB3WVEVKZB&qid=1601494762&refinements=p_36%3A3900-5000%2Cp_n_free_shipping_eligible%3A5363790051%2Cp_72%3A2547912051%2Cp_6%3AANEGB3WVEVKZB&rnid=5355409051&s=kitchen&sr=1-196
0,"Cook N Home 8-Cup Stainless Steel Stovetop Coffee Percolator Pot Kettle, Tea",Cook N Home,"'Made of mirror polished stainless steel to retain heat and is non-reactive; holds 8 cups max', 'Stainless steel Permanent filter basket is removable for easy cleaning and reusable', 'Tight seal lid with a clear knob to view percolating; handle is comfortable and stays cool', 'Can be used to make Coffee, tea, and boil water; drip-free spout and has a classic design. Product Dimensions 5 x 8 x 8 inches', 'Not induction compatible and works on all other stovetops; dishwasher safe and fully immersible'","'Brand Cook N Home', 'Model Number 2544', 'Color Silver', 'Product Dimensions 12.7 x 20.32 x 20.32 cm; 771.11 Grams', 'Capacity 8 Cups', 'Material Stainless Steel', 'Special Features Gas Stovetop Compatible, Electric Stovetop Compatible, Dishwasher Safe', 'Item Weight 771 g'","'The Cook N Home 8-Cup Stainless Steel Stovetop Coffee Percolator Pot Kettle, Tea is made of mirror polished stainless steel to retain heat, is non-reactive, and looks great. Holds up to 8 cups/1.9 liters of liquid. Stainless steel permanent filter basket is removable for easy cleaning and reusable. Tight seal lid with a clear knob to view percolating. Handle is comfortable and stays cool with an ergonomic grip. Can be used to make coffee, tea, and boil water. Drip-free spout and has a classic design to match any kitchen style. Wide hinged lid will not get lost. Induction compatible and works on all stovetops. Not oven safe. Dishwasher safe and fully immersible.'",['In stock.'],Amazon AU,Amazon AU,$41.71,https://www.amazon.com.au/8-Cup-Stainless-Stovetop-Coffee-Percolator/dp/B074WC9QTJ/ref=sr_1_130?dchild=1&m=ANEGB3WVEVKZB&qid=1601494762&refinements=p_36%3A3900-5000%2Cp_n_free_shipping_eligible%3A5363790051%2Cp_72%3A2547912051%2Cp_6%3AANEGB3WVEVKZB&rnid=5355409051&s=kitchen&sr=1-130
